http://unfccc.int/files/adaptation/application/pdf/masdar.pdf,Masdar City,WSP Group; Foster + Partners,Construction and Engineering,"Transport, infrastructure and human settlements;",United Arab Emirates,GBR,0,0
http://unfccc.int/files/adaptation/application/pdf/urs_corporation.pdf,The effects of climate change on highway network policies and standards,URS Corporation,Construction and Engineering,"Transport, infrastructure and human settlements",United Kingdom,GBR,0,0
http://unfccc.int/files/adaptation/application/pdf/thames_water.pdf,Taking care of water: Adapting business operations,Thames Water,Energy and Utilities,Water resources,United Kingdom,GBR,0,0
http://unfccc.int/files/adaptation/application/pdf/network_rail.pdf,Tomorrow’s railway and climate change adaptation,Network Rail Infrastructure Limited,Transport and Logistics,"Transport, infrastructure and human settlements",United Kingdom,GBR,0,0
http://unfccc.int/files/adaptation/application/pdf/anglian_water.pdf,Guaranteeing security of supplies,Anglian Water,Water Management,Water resources,United Kingdom,GBR,0,0
http://unfccc.int/files/adaptation/application/pdf/gsk.pdf,New variety of blackcurrants to survive mild winters,GlaxoSmithKline (GSK) (Ribena) and Scottish Crop Research Institute,Agriculture; Food and Beverages,"Food security, agriculture, forestry and fisheries; Science, assessment, monitoring and early warning",United Kingdom,GBR,0,0
http://unfccc.int/files/adaptation/application/pdf/scotch_whisky_association.pdf,Working collectively to address the whisky industry’s long-term risks,Scotch Whisky Association (SWA); Scotch Whisky Research Institute (SWRI),Foodand Beverages,"Food security, agriculture, forestry and fisheries; Water resources",United Kingdom,GBR,0,0
http://unfccc.int/files/adaptation/application/pdf/hsbc.pdf,New insurance products and climate risk,HSBC,Financial Services,"Business; Transport, infrastructure and human settlements",United Kingdom,GBR,0,0
